{
  "$schema": "../../../schemas/creation-memory.schema.json",
  "schema_version": 1,
  "episode_id": "EP004",
  "updated_at": "2026-08-17T22:20:56.146Z",
  "creator_contract": {
    "creative_actor": "codex",
    "sole_creative_actor": true,
    "deterministic_system_roles": [
      "schema_validation",
      "state_storage",
      "context_retrieval",
      "prompt_assembly",
      "file_tracking",
      "text_and_page_rendering"
    ],
    "human_roles": [
      "goal_input",
      "exception_resolution",
      "release_approval"
    ]
  },
  "source_refs": [
    {
      "id": "source-story-1",
      "type": "story",
      "path": "episodes/EP004/script/script.md",
      "purpose": "장면 의도와 패널 대사의 기준",
      "required": true
    },
    {
      "id": "source-decisions-2",
      "type": "decisions",
      "path": "episodes/EP004/decisions/implementation-notes.json",
      "purpose": "과거 결정의 근거와 승인 상태",
      "required": false
    },
    {
      "id": "source-policy-3",
      "type": "policy",
      "path": "config/panel-generation-policy.json",
      "purpose": "동시성, 재시도, QA와 에스컬레이션 기준",
      "required": true
    }
  ],
  "canon_assets": [],
  "narrative_threads": [],
  "continuity": [],
  "preferences": [],
  "lessons": [],
  "constraints": [
    {
      "id": "constraint-one-image-per-request",
      "severity": "must",
      "rule": "gpt-image-2에는 요청당 이미지 한 장만 생성한다.",
      "scope": {
        "characters": [],
        "panel_ids": [],
        "tags": [
          "global",
          "generation"
        ]
      },
      "source_path": "config/panel-generation-policy.json"
    },
    {
      "id": "constraint-preserve-original-candidates",
      "severity": "must",
      "rule": "원본과 탈락 후보를 덮어쓰지 않고 선택된 결과만 정식 패널로 승격한다.",
      "scope": {
        "characters": [],
        "panel_ids": [],
        "tags": [
          "global",
          "candidate-selection"
        ]
      },
      "source_path": "docs/ASSET-STORAGE-POLICY.md"
    },
    {
      "id": "constraint-human-release-approval",
      "severity": "must",
      "rule": "Codex가 모든 창작 행동을 수행하더라도 최종 공개는 사람의 Release Approval 이후에만 실행한다.",
      "scope": {
        "characters": [],
        "panel_ids": [],
        "tags": [
          "global",
          "approval"
        ]
      },
      "source_path": "docs/AI-COLLABORATION-PROTOCOL.md"
    }
  ],
  "handoff": {
    "current_goal": "파일럿 시즌 제작·공개 완료",
    "current_phase": "phase6_release",
    "target_panel_id": null,
    "completed": [
      "43컷 생성·교정·조판 완료",
      "Phase 5 QA 43/50",
      "전체 시즌 오프라인 뷰어 완성",
      "Pages 공개 및 390/1440px 실제 사이트 검증 완료"
    ],
    "next_actions": [
      "파일럿 시즌은 완결되었다. 새 사용자 요청을 기다린다."
    ],
    "blockers": [],
    "human_decisions": []
  }
}
