{
  "$schema": "../../../schemas/creation-memory.schema.json",
  "schema_version": 1,
  "episode_id": "EP002",
  "updated_at": "2026-09-08T21:02:14Z",
  "creator_contract": {
    "creative_actor": "codex",
    "sole_creative_actor": true,
    "deterministic_system_roles": [
      "schema_validation",
      "state_storage",
      "context_retrieval",
      "prompt_assembly",
      "file_tracking",
      "text_and_page_rendering"
    ],
    "human_roles": [
      "goal_input",
      "exception_resolution",
      "release_approval"
    ]
  },
  "source_refs": [
    {
      "id": "source-story-1",
      "type": "story",
      "path": "episodes/EP002/script/script.json",
      "purpose": "장면 의도와 패널 대사의 구조화된 기준",
      "required": true
    },
    {
      "id": "source-character-2",
      "type": "character",
      "path": "episodes/EP002/characters/characters.json",
      "purpose": "캐릭터 외형과 참조 자산의 기준",
      "required": false
    },
    {
      "id": "source-storyboard-3",
      "type": "storyboard",
      "path": "episodes/EP002/storyboard/storyboard.json",
      "purpose": "페이지와 패널 구도의 기준",
      "required": false
    },
    {
      "id": "source-panels-4",
      "type": "panels",
      "path": "episodes/EP002/panels/panels.json",
      "purpose": "패널 생성 상태와 실제 참조 연결",
      "required": false
    },
    {
      "id": "source-decisions-5",
      "type": "decisions",
      "path": "episodes/EP002/decisions/implementation-notes.json",
      "purpose": "과거 결정의 근거와 승인 상태",
      "required": false
    },
    {
      "id": "source-policy-6",
      "type": "policy",
      "path": "config/panel-generation-policy.json",
      "purpose": "동시성, 재시도, QA와 에스컬레이션 기준",
      "required": true
    },
    {
      "id": "source-series-bible-7",
      "type": "series_bible",
      "path": "series/bible/registry.json",
      "purpose": "공통 Series Bible v1.0과 EP002 delta를 병합하는 단일 Series Bible 진입점",
      "required": true
    }
  ],
  "canon_assets": [],
  "narrative_threads": [],
  "continuity": [],
  "preferences": [],
  "lessons": [],
  "constraints": [
    {
      "id": "constraint-one-image-per-request",
      "severity": "must",
      "rule": "gpt-image-2에는 요청당 이미지 한 장만 생성한다.",
      "scope": {
        "characters": [],
        "panel_ids": [],
        "tags": [
          "global",
          "generation"
        ]
      },
      "source_path": "config/panel-generation-policy.json"
    },
    {
      "id": "constraint-preserve-original-candidates",
      "severity": "must",
      "rule": "원본과 탈락 후보를 덮어쓰지 않고 선택된 결과만 정식 패널로 승격한다.",
      "scope": {
        "characters": [],
        "panel_ids": [],
        "tags": [
          "global",
          "candidate-selection"
        ]
      },
      "source_path": "docs/ASSET-STORAGE-POLICY.md"
    },
    {
      "id": "constraint-human-release-approval",
      "severity": "must",
      "rule": "Codex가 모든 창작 행동을 수행하더라도 최종 공개는 사람의 Release Approval 이후에만 실행한다.",
      "scope": {
        "characters": [],
        "panel_ids": [],
        "tags": [
          "global",
          "approval"
        ]
      },
      "source_path": "docs/AI-COLLABORATION-PROTOCOL.md"
    }
  ],
  "handoff": {
    "current_goal": "EP002 카운트다운의 phase4_panels 창작 작업을 이어간다.",
    "current_phase": "phase4_panels",
    "target_panel_id": null,
    "completed": [
      "phase0 완료",
      "phase0.5 완료",
      "phase1 완료",
      "phase2 완료",
      "phase3 완료",
      "2026-09-09 파일·상태 대조: PNG 49/57, SVG 45/49, draft 18, needs_review 4. 증거: reports/CLE3-EP002-STATUS-AUDIT-20260909.json"
    ],
    "next_actions": [
      "p10-1의 기존 draft 텍스트 오버레이를 검토한 뒤 SVG 렌더링 가능 여부를 확인한다. p10-4는 SVG가 존재하므로 재생성하지 않고 draft 오버레이를 검토한다.",
      "p8-2~p8-4의 script/storyboard 매핑을 rebaseline한 뒤 페이지 8 오버레이를 검토한다.",
      "p7-2와 p7-3의 페이지 7 인접 패널 연속성과 텍스트 오버레이를 QA한다.",
      "p5-3과 p5-4의 draft 텍스트 오버레이 위치를 시각 검토하고 QA 상태를 확정한다.",
      "18개의 draft 텍스트 오버레이를 시각 검토하고 위치·문구를 확정한다. needs_review 4개(p2-1, p8-2~p8-4)는 별도 입력 확인이 필요하다.",
      "p5-2의 draft 대사 오버레이 위치를 시각 검토하고 QA 상태를 확정한다.",
      "p4-2, p4-3, p4-4 생성 결과의 대사 오버레이 위치를 검토하고 QA 상태를 확정한다.",
      "쯔쯔와 EP002 전용 장소·소품은 별도 증거를 확보한 뒤 delta에 추가한다.",
      "완성 패널과 텍스트 오버레이를 대상으로 Phase 5 QA를 준비한다.",
      "페이지 6 전체의 시각 연속성과 오버레이를 QA한다."
    ],
    "blockers": [],
    "human_decisions": [
      "완료 Phase의 provisional gate를 공식 승인할지 결정",
      "Phase 5 통과 후 공개 여부 결정"
    ]
  }
}
